[
  {
    "name": "concrete",
    "group": "aggregates",
    "description": "A composite material made from aggregate, cement, and water.",
    "density": 2400,
    "porosity": 1.5,
    "moisture": 5,
    "diffusion_resistance": 150,
    "compressive_strength": 30,
    "tensile_strength": 3,
    "elastic_modulus": 30,
    "shear_strength": 15,
    "thermal_conductivity": 1.4,
    "thermal_resistance": 0.007,
    "thermal_expansion": 0.000012,
    "heat_capacity": 900,
    "fire_resistance": "REI120",
    "fire_reaction": "A1",
    "carbon": 0.18,
    "energy": 200,
    "water": 0.5,
    "toxicity": "low",
    "recyclability": 50
  },
  {
    "name": "cement",
    "group": "aggregates",
    "description": "The binding agent in concrete and mortar.",
    "density": 3150,
    "porosity": 30,
    "moisture": 1,
    "diffusion_resistance": 5,
    "compressive_strength": null,
    "tensile_strength": null,
    "elastic_modulus": null,
    "shear_strength": null,
    "thermal_conductivity": 0.8,
    "thermal_resistance": null,
    "thermal_expansion": 0.00001,
    "heat_capacity": 1000,
    "fire_resistance": null,
    "fire_reaction": "A1",
    "carbon": 0.8,
    "energy": 4000,
    "water": 0.1,
    "toxicity": "low",
    "recyclability": 80
  },
  {
    "name": "sand",
    "group": "aggregates",
    "description": "A fine aggregate used in concrete, mortar, and plaster.",
    "density": 1600,
    "porosity": 30,
    "moisture": 2,
    "diffusion_resistance": null,
    "compressive_strength": null,
    "tensile_strength": null,
    "elastic_modulus": null,
    "shear_strength": null,
    "thermal_conductivity": 0.5,
    "thermal_resistance": null,
    "thermal_expansion": 0.00001,
    "heat_capacity": 800,
    "fire_resistance": null,
    "fire_reaction": "A1",
    "carbon": 0.01,
    "energy": 20,
    "water": 0.001,
    "toxicity": "none",
    "recyclability": 100
  },
  {
    "name": "gravel",
    "group": "aggregates",
    "description": "A coarse aggregate essential for concrete mixes.",
    "density": 1500,
    "porosity": 30,
    "moisture": 2,
    "diffusion_resistance": null,
    "compressive_strength": null,
    "tensile_strength": null,
    "elastic_modulus": null,
    "shear_strength": null,
    "thermal_conductivity": 0.4,
    "thermal_resistance": null,
    "thermal_expansion": 0.00001,
    "heat_capacity": 800,
    "fire_resistance": null,
    "fire_reaction": "A1",
    "carbon": 0.005,
    "energy": 10,
    "water": 0.001,
    "toxicity": "none",
    "recyclability": 100
  },
  {
    "name": "stone",
    "group": "aggregates",
    "description": "Another form of coarse aggregate for concrete.",
    "density": 2700,
    "porosity": 1,
    "moisture": 0.5,
    "diffusion_resistance": null,
    "compressive_strength": 100,
    "tensile_strength": 10,
    "elastic_modulus": 70,
    "shear_strength": 40,
    "thermal_conductivity": 1.8,
    "thermal_resistance": null,
    "thermal_expansion": 0.000008,
    "heat_capacity": 800,
    "fire_resistance": null,
    "fire_reaction": "A1",
    "carbon": 0.05,
    "energy": 150,
    "water": 0.0001,
    "toxicity": "none",
    "recyclability": 95
  },
  {
    "name": "mortar",
    "group": "aggregates",
    "description": "A workable paste used to bind building blocks such as bricks and stones.",
    "density": 1900,
    "porosity": 10,
    "moisture": 5,
    "diffusion_resistance": 80,
    "compressive_strength": 15,
    "tensile_strength": 1.5,
    "elastic_modulus": 15,
    "shear_strength": 7,
    "thermal_conductivity": 0.9,
    "thermal_resistance": 0.001,
    "thermal_expansion": 0.000011,
    "heat_capacity": 950,
    "fire_resistance": "R60",
    "fire_reaction": "A1",
    "carbon": 0.15,
    "energy": 180,
    "water": 0.3,
    "toxicity": "low",
    "recyclability": 40
  },
  {
    "name": "grout",
    "group": "aggregates",
    "description": "A dense fluid used to fill gaps or as reinforcement in existing structures.",
    "density": 2200,
    "porosity": 5,
    "moisture": 3,
    "diffusion_resistance": 100,
    "compressive_strength": 40,
    "tensile_strength": 4,
    "elastic_modulus": 25,
    "shear_strength": 12,
    "thermal_conductivity": 1.2,
    "thermal_resistance": 0.0008,
    "thermal_expansion": 0.000011,
    "heat_capacity": 900,
    "fire_resistance": "R120",
    "fire_reaction": "A1",
    "carbon": 0.16,
    "energy": 190,
    "water": 0.4,
    "toxicity": "low",
    "recyclability": 30
  },
  {
    "name": "steel",
    "group": "metals",
    "description": "Steel sections like I-beams, H-beams, and channels used for framing.",
    "density": 7850,
    "porosity": 0.01,
    "moisture": 0,
    "diffusion_resistance": 0,
    "compressive_strength": 350,
    "tensile_strength": 450,
    "elastic_modulus": 200,
    "shear_strength": 270,
    "thermal_conductivity": 50,
    "thermal_resistance": null,
    "thermal_expansion": 0.000012,
    "heat_capacity": 460,
    "fire_resistance": null,
    "fire_reaction": "A1",
    "carbon": 1.5,
    "energy": 25000,
    "water": 0.00001,
    "toxicity": "none",
    "recyclability": 98
  },
  {
    "name": "rebar",
    "group": "metals",
    "description": "Steel bars used to reinforce concrete.",
    "density": 7850,
    "porosity": 0.01,
    "moisture": 0,
    "diffusion_resistance": 0,
    "compressive_strength": 400,
    "tensile_strength": 500,
    "elastic_modulus": 200,
    "shear_strength": 300,
    "thermal_conductivity": 45,
    "thermal_resistance": null,
    "thermal_expansion": 0.000012,
    "heat_capacity": 460,
    "fire_resistance": null,
    "fire_reaction": "A1",
    "carbon": 1.5,
    "energy": 25000,
    "water": 0.00001,
    "toxicity": "none",
    "recyclability": 98
  },
  {
    "name": "aluminum",
    "group": "metals",
    "description": "A lightweight and corrosion-resistant metal used for window frames, roofing, and cladding.",
    "density": 2700,
    "porosity": 0.001,
    "moisture": 0,
    "diffusion_resistance": 0,
    "compressive_strength": 300,
    "tensile_strength": 350,
    "elastic_modulus": 70,
    "shear_strength": 200,
    "thermal_conductivity": 205,
    "thermal_resistance": null,
    "thermal_expansion": 0.000023,
    "heat_capacity": 900,
    "fire_resistance": null,
    "fire_reaction": "A1",
    "carbon": 8.2,
    "energy": 60000,
    "water": 0.00002,
    "toxicity": "none",
    "recyclability": 95
  },
  {
    "name": "copper",
    "group": "metals",
    "description": "Used for wiring, plumbing, and roofing due to its conductivity and durability.",
    "density": 8960,
    "porosity": 0.001,
    "moisture": 0,
    "diffusion_resistance": 0,
    "compressive_strength": 300,
    "tensile_strength": 220,
    "elastic_modulus": 110,
    "shear_strength": 160,
    "thermal_conductivity": 400,
    "thermal_resistance": null,
    "thermal_expansion": 0.000017,
    "heat_capacity": 385,
    "fire_resistance": null,
    "fire_reaction": "A1",
    "carbon": 4.6,
    "energy": 70000,
    "water": 0.00003,
    "toxicity": "none",
    "recyclability": 95
  },
  {
    "name": "iron",
    "group": "metals",
    "description": "A primary component of steel, also used in various other forms.",
    "density": 7874,
    "porosity": 0.005,
    "moisture": 0,
    "diffusion_resistance": 0,
    "compressive_strength": 150,
    "tensile_strength": 100,
    "elastic_modulus": 190,
    "shear_strength": 130,
    "thermal_conductivity": 80,
    "thermal_resistance": null,
    "thermal_expansion": 0.000012,
    "heat_capacity": 450,
    "fire_resistance": null,
    "fire_reaction": "A1",
    "carbon": 3,
    "energy": 18000,
    "water": 0.00001,
    "toxicity": "none",
    "recyclability": 90
  },
  {
    "name": "lead",
    "group": "metals",
    "description": "Used for roofing, flashing, and radiation shielding.",
    "density": 11340,
    "porosity": 0.001,
    "moisture": 0,
    "diffusion_resistance": 0,
    "compressive_strength": 10,
    "tensile_strength": 20,
    "elastic_modulus": 16,
    "shear_strength": 7,
    "thermal_conductivity": 35,
    "thermal_resistance": null,
    "thermal_expansion": 0.000029,
    "heat_capacity": 130,
    "fire_resistance": null,
    "fire_reaction": "A1",
    "carbon": 5,
    "energy": 5000,
    "water": 0.00001,
    "toxicity": "high",
    "recyclability": 99
  },
  {
    "name": "zinc",
    "group": "metals",
    "description": "Primarily used for galvanizing steel to protect it from corrosion.",
    "density": 7130,
    "porosity": 0.001,
    "moisture": 0,
    "diffusion_resistance": 0,
    "compressive_strength": 200,
    "tensile_strength": 100,
    "elastic_modulus": 80,
    "shear_strength": 60,
    "thermal_conductivity": 116,
    "thermal_resistance": null,
    "thermal_expansion": 0.00003,
    "heat_capacity": 390,
    "fire_resistance": null,
    "fire_reaction": "A1",
    "carbon": 3.9,
    "energy": 50000,
    "water": 0.00002,
    "toxicity": "low",
    "recyclability": 90
  },
  {
    "name": "wire",
    "group": "metals",
    "description": "Used in cranes, elevators, and bridges.",
    "density": 7850,
    "porosity": 0.001,
    "moisture": 0,
    "diffusion_resistance": 0,
    "compressive_strength": null,
    "tensile_strength": 1500,
    "elastic_modulus": 200,
    "shear_strength": null,
    "thermal_conductivity": 40,
    "thermal_resistance": null,
    "thermal_expansion": 0.000012,
    "heat_capacity": 460,
    "fire_resistance": null,
    "fire_reaction": "A1",
    "carbon": 1.5,
    "energy": 25000,
    "water": 0.00001,
    "toxicity": "none",
    "recyclability": 98
  },
  {
    "name": "bricks",
    "group": "masonry",
    "description": "A fundamental building material known for its durability and fire resistance.",
    "density": 1900,
    "porosity": 15,
    "moisture": 6,
    "diffusion_resistance": 10,
    "compressive_strength": 20,
    "tensile_strength": 2,
    "elastic_modulus": 15,
    "shear_strength": 8,
    "thermal_conductivity": 0.7,
    "thermal_resistance": 0.001,